{
  "config_id": "6b0a2ed47cef742ec4225a835358ce4ac4f043b03d993d32bcc6e4fcf68b7afb",
  "input_token_ceiling": 8192,
  "max_output_tokens": 256,
  "model": "anthropic/claude-haiku-4-5-20251001",
  "output_config": {
    "format": {
      "schema": {
        "additionalProperties": false,
        "properties": {
          "outcome": {
            "enum": [
              "auto-approve",
              "auto-decline",
              "escalate"
            ],
            "type": "string"
          }
        },
        "required": [
          "outcome"
        ],
        "type": "object"
      },
      "type": "json_schema"
    }
  },
  "price_table_version": "245d2d3dd12226e11e1328b65a7a63eb2db964b9e40a71eb56a0f30d07e6bcc2",
  "prompt_version": "b235b57fc482f455e5658beaa78683b740416f8c788ab2024253c404c509fc1e",
  "provider": "anthropic",
  "schema_version": "run-config-v1",
  "temperature": 0,
  "threshold_config_ids": {
    "tenant-a": "73706a2c45d7f2602ee7584587d4dfb56e6127bd2836184216821fc6a65155cd",
    "tenant-b": "451ebb75350abdc77ee6e3eb742cdf0345d3e11d99c2749f64b1af7a460ec4ae"
  },
  "timeout_seconds": 60
}
